{
  "$schema": "ops/schemas/shadow-apply-report.schema.json",
  "mode": "shadow",
  "status": "ready_for_live_apply",
  "generated_at": "2026-05-07T03:07:18Z",
  "source_manifest": {
    "schema": "ops/schemas/changed-files-manifest.schema.json",
    "run_id": "run-20260507-auto-improve-iteration-persistence-discard-path"
  },
  "guard": {
    "allowed_apply_roots": [
      "ops/",
      "tests/",
      "system/system-log.md"
    ],
    "changed_paths": [
      "ops/scripts/auto_improve_iteration_persistence_runtime.py"
    ],
    "invalid_paths": [],
    "disallowed_paths": []
  },
  "summary": {
    "total_changed_files": 1,
    "added": 0,
    "modified": 1,
    "deleted": 0
  },
  "files": [
    {
      "path": "ops/scripts/auto_improve_iteration_persistence_runtime.py",
      "change_type": "modified",
      "live_exists": true,
      "workspace_exists": true,
      "would_write": true,
      "would_delete": false
    }
  ],
  "metadata": {
    "properties": [
      {
        "name": "urn:openai:archived-run-backfill",
        "value": "{\"archive_reason\": \"run_artifact_embedded_envelope_backfill\", \"envelope_mode\": \"metadata.properties\", \"generated_at\": \"2026-05-07T03:07:18Z\", \"generated_at_source\": \"payload.generated_at\", \"helper\": \"ops.scripts.backfill_archived_run_artifacts\", \"normalized_at\": \"2026-05-07T17:20:47Z\", \"source_artifact\": \"runs/run-20260507-auto-improve-iteration-persistence-discard-path/shadow-apply-report.json\"}"
      },
      {
        "name": "urn:openai:artifact-envelope",
        "value": "{\"$schema\": \"ops/schemas/shadow-apply-report.schema.json\", \"artifact_kind\": \"shadow_apply_report\", \"artifact_status\": \"archived\", \"currentness\": {\"checked_at\": \"2026-05-07T17:20:47Z\", \"status\": \"current\"}, \"encoding\": \"utf-8\", \"generated_at\": \"2026-05-07T03:07:18Z\", \"input_fingerprints\": {\"archived_run_payload_before_backfill\": \"e79bad49d23466a1fb87bbf7c0ad4500577077a5e6ccbc8cdd59e637036e4f6a\", \"artifact_envelope_schema\": \"87fcb7b91ffc04e8180c1c3e51e309cde186ecf23f91f7974a541d0b580976de\", \"envelope_mode\": \"f9416f4de9dee1f94a28cfe3816ddf91a55b45560a990e9279c2582a6cf47e35\", \"generated_at_source\": \"fc0340f868a19c5980eebfb4b9eb41620ff6571ed9de83a030bf0a59b3d20be6\", \"policy\": \"0ea507a6c856f415081476dad6bc1b650390c534db7dc9ffdd30bf4b634bf107\", \"schema\": \"03d6cfbd3c05552cf04b4ce334fcf36d0c72b2e19458e3f5672a1d9beefd7ef7\", \"target_rel_path\": \"b0ca08095218be183451dca905d577acf80b4a028a1a8749e97d7798fcb5ec38\"}, \"producer\": \"ops.scripts.backfill_archived_run_artifacts\", \"retention_policy\": \"archive\", \"schema_version\": 1, \"source_command\": \"python -m ops.scripts.backfill_archived_run_artifacts --vault . --path runs/run-20260507-auto-improve-iteration-persistence-discard-path/shadow-apply-report.json\", \"source_revision\": \"unknown\", \"source_tree_fingerprint\": \"a29a1f5a6ec3e4ac4ac8d79cc69437a5f5e5b6bc55285a780721c53e67d5149d\"}"
      }
    ]
  }
}
